outputs/hcaf_audioresnet_pq_seqmodels_iter2/overall_results.csv

experiment,display_name,group,modality,window_sec,window_accuracy_mean,window_accuracy_std,window_macro_f1_mean,window_macro_f1_std,window_precision_mean,window_precision_std,window_recall_mean,window_recall_std,best_session_method,session_accuracy_mean,session_accuracy_std,session_macro_f1_mean,session_macro_f1_std,session_precision_mean,session_precision_std,session_recall_mean,session_recall_std
hcaf_audio_r18img_pq_tcn_5s,Audio R18 ImageNet + PQ TCN (baseline),main,multimodal,5.0,0.9175978302955627,0.07219679653644562,0.9145029187202454,0.07452479004859924,0.9448249936103821,0.03496289253234863,0.9153595566749573,0.07234998792409897,majority_voting,0.9444444179534912,0.07856743037700653,0.9407407641410828,0.08380524069070816,0.9629629254341125,0.052378274500370026,0.9444444179534912,0.07856743037700653
hcaf_audio_r18img_pq_tcn_sched_5s,Audio R18 ImageNet + PQ TCN (ReduceLROnPlateau),main,multimodal,5.0,0.9166865348815918,0.08036164939403534,0.9110878109931946,0.08264147490262985,0.9494908452033997,0.04071532189846039,0.9092045426368713,0.07713042944669724,majority_voting,0.9444444179534912,0.07856743037700653,0.9407407641410828,0.08380524069070816,0.9629629254341125,0.052378274500370026,0.9444444179534912,0.07856743037700653

outputs/hcaf_audioresnet_pq_seqmodels_iter2/EXPERIMENT_SUMMARY.md

## summary_mmmodel | hcaf_audio_r18img_pq_tcn_5s

- model: `Audio R18 ImageNet + PQ TCN (baseline)`
- modality: `multimodal`
- group: `main`
- window_sec: `5.0`
- window_mean_std: acc=0.9176 ± 0.0722, macro-F1=0.9145 ± 0.0745, precision=0.9448 ± 0.0350, recall=0.9154 ± 0.0723
- best_session_method: `majority_voting`
- session_mean_std: acc=0.9444 ± 0.0786, macro-F1=0.9407 ± 0.0838, precision=0.9630 ± 0.0524, recall=0.9444 ± 0.0786

## summary_mmmodel | hcaf_audio_r18img_pq_tcn_sched_5s

- model: `Audio R18 ImageNet + PQ TCN (ReduceLROnPlateau)`
- modality: `multimodal`
- group: `main`
- window_sec: `5.0`
- window_mean_std: acc=0.9167 ± 0.0804, macro-F1=0.9111 ± 0.0826, precision=0.9495 ± 0.0407, recall=0.9092 ± 0.0771
- best_session_method: `majority_voting`
- session_mean_std: acc=0.9444 ± 0.0786, macro-F1=0.9407 ± 0.0838, precision=0.9630 ± 0.0524, recall=0.9444 ± 0.0786